{
  "id": "0b6c1d52-5d4e-4c0a-9c3e-1d2f3a4b5c6d",
  "v": 1,
  "kind": "call",
  "ref": "call:S1.L3/c1",
  "provenance": "assisted",
  "exposure": "seen",
  "at": "2026-10-24T05:20:00+01:00",
  "tz": -720,
  "day": "2026-10-24",
  "dev": "dev-9f3a",
  "itemRev": "3f9a",
  "engine": "z3@5.3.1",
  "seed": 4294967295,
  "ok": false,
  "conf": "sure",
  "resp": {
    "picked": "B",
    "text": "unsat"
  },
  "mis": "dp:L4",
  "ms": 1234.5,
  "data": {
    "sha256": "abababababababababababababababababababababababababababababababab",
    "checks": {
      "c1": "pass"
    }
  }
}
